{
  "id": "abc123def456",
  "amount": 100.0,
  "currency": "USD",
  "merchant_order_id": "abc123def456",
  "status": "CREATED",
  "client_secret": "example-value",
  "captured_amount": 100.0,
  "customer_id": "abc123def456",
  "payment_method_options": {},
  "descriptor": "example-value",
  "metadata": {},
  "created_at": "2026-04-19T10:30:00Z",
  "updated_at": "2026-04-19T10:30:00Z"
}